{"format":"bodyarcade-trace","version":1,"fps":30,"aspect":1.333333,"meta":{"id":"example-stand-jump","origin":"synthetic","framing":"full","model":"synthetic stick figure (core/pose/synth.ts)","notes":"Format example only. Synthetic frames are not evidence for any threshold."},"labels":[{"t":0,"id":"still","kind":"marker","note":"standing, arms down"},{"t":200,"id":"jump","kind":"rep"},{"t":660,"id":"leave","kind":"marker"}],"frames":[{"t":0,"lm":[0.5041,0.2299,-0.25,0.97,0.5038,0.2182,-0.23,0.97,0.5088,0.2188,-0.23,0.97,0.5117,0.2156,-0.22,0.97,0.4925,0.2211,-0.23,0.97,0.4928,0.2193,-0.23,0.97,0.4865,0.2182,-0.22,0.97,0.5254,0.2224,-0.1,0.97,0.4788,0.2257,-0.1,0.97,0.5084,0.2437,-0.22,0.97,0.4944,0.2465,-0.22,0.97,0.5581,0.3223,-0.05,0.97,0.4395,0.3182,-0.05,0.97,0.574,0.4396,-0.05,0.97,0.4262,0.4428,-0.05,0.97,0.5762,0.551,-0.08,0.97,0.4262,0.5459,-0.08,0.97,0.5806,0.5703,-0.09,0.9,0.422,0.5695,-0.09,0.9,0.5759,0.5729,-0.1,0.9,0.4239,0.5755,-0.1,0.9,0.5712,0.5644,-0.1,0.9,0.4284,0.5663,-0.1,0.9,0.542,0.5203,0,0.97,0.4639,0.5184,0,0.97,0.5387,0.7032,-0.05,0.97,0.463,0.7009,-0.05,0.97,0.5405,0.8779,0.05,0.93,0.4602,0.8814,0.05,0.93,0.5359,0.8938,0.12,0.9,0.4639,0.8914,0.12,0.9,0.5428,0.9008,-0.1,0.9,0.4524,0.8976,-0.1,0.9]},{"t":33.3,"lm":[0.5,0.2275,-0.25,0.97,0.5081,0.2217,-0.23,0.97,0.5113,0.2173,-0.23,0.97,0.5104,0.2177,-0.22,0.97,0.4934,0.2177,-0.23,0.97,0.49,0.2159,-0.23,0.97,0.4868,0.2184,-0.22,0.97,0.5225,0.2246,-0.1,0.97,0.4765,0.2265,-0.1,0.97,0.5059,0.2472,-0.22,0.97,0.4945,0.244,-0.22,0.97,0.5579,0.3223,-0.05,0.97,0.4416,0.3188,-0.05,0.97,0.5714,0.4393,-0.05,0.97,0.4287,0.4387,-0.05,0.97,0.5759,0.5492,-0.08,0.97,0.4237,0.5515,-0.08,0.97,0.5794,0.5691,-0.09,0.9,0.4206,0.5712,-0.09,0.9,0.5776,0.5709,-0.1,0.9,0.4245,0.5729,-0.1,0.9,0.5696,0.5657,-0.1,0.9,0.4286,0.5653,-0.1,0.9,0.5358,0.5217,0,0.97,0.4628,0.519,0,0.97,0.5362,0.7005,-0.05,0.97,0.4639,0.6968,-0.05,0.97,0.5372,0.8793,0.05,0.93,0.4631,0.8812,0.05,0.93,0.536,0.8957,0.12,0.9,0.4639,0.8918,0.12,0.9,0.5448,0.8955,-0.1,0.9,0.4553,0.8967,-0.1,0.9]},{"t":66.7,"lm":[0.4996,0.2268,-0.25,0.97,0.5021,0.2155,-0.23,0.97,0.5094,0.2159,-0.23,0.97,0.5136,0.2172,-0.22,0.97,0.4946,0.2173,-0.23,0.97,0.4929,0.2212,-0.23,0.97,0.4872,0.2201,-0.22,0.97,0.521,0.2247,-0.1,0.97,0.4781,0.225,-0.1,0.97,0.5082,0.2509,-0.22,0.97,0.4919,0.2454,-0.22,0.97,0.5572,0.3162,-0.05,0.97,0.4407,0.3158,-0.05,0.97,0.574,0.4399,-0.05,0.97,0.4274,0.4408,-0.05,0.97,0.5756,0.5496,-0.08,0.97,0.4245,0.5494,-0.08,0.97,0.5776,0.5691,-0.09,0.9,0.418,0.5691,-0.09,0.9,0.5745,0.5737,-0.1,0.9,0.4234,0.5751,-0.1,0.9,0.5676,0.5648,-0.1,0.9,0.4308,0.5685,-0.1,0.9,0.5363,0.5193,0,0.97,0.4628,0.5186,0,0.97,0.5349,0.7021,-0.05,0.97,0.4625,0.7003,-0.05,0.97,0.5383,0.8785,0.05,0.93,0.4627,0.8737,0.05,0.93,0.5355,0.8941,0.12,0.9,0.4618,0.8915,0.12,0.9,0.5429,0.8961,-0.1,0.9,0.4541,0.8999,-0.1,0.9]},{"t":100,"lm":[0.5003,0.23,-0.25,0.97,0.5041,0.2171,-0.23,0.97,0.5088,0.2177,-0.23,0.97,0.5118,0.2179,-0.22,0.97,0.4948,0.2189,-0.23,0.97,0.4899,0.2168,-0.23,0.97,0.486,0.217,-0.22,0.97,0.5242,0.2268,-0.1,0.97,0.4794,0.2236,-0.1,0.97,0.5062,0.2525,-0.22,0.97,0.4942,0.2445,-0.22,0.97,0.5598,0.3185,-0.05,0.97,0.4389,0.3189,-0.05,0.97,0.572,0.4362,-0.05,0.97,0.4282,0.4383,-0.05,0.97,0.5734,0.5506,-0.08,0.97,0.4248,0.5511,-0.08,0.97,0.5802,0.5674,-0.09,0.9,0.4177,0.5728,-0.09,0.9,0.5718,0.5732,-0.1,0.9,0.4215,0.575,-0.1,0.9,0.5702,0.5663,-0.1,0.9,0.431,0.5664,-0.1,0.9,0.5373,0.5193,0,0.97,0.4632,0.5202,0,0.97,0.5344,0.7001,-0.05,0.97,0.4615,0.6997,-0.05,0.97,0.5336,0.8823,0.05,0.93,0.4595,0.8784,0.05,0.93,0.5364,0.8923,0.12,0.9,0.4656,0.8911,0.12,0.9,0.5454,0.9025,-0.1,0.9,0.454,0.8995,-0.1,0.9]},{"t":133.3,"lm":[0.5017,0.2291,-0.25,0.97,0.5052,0.2177,-0.23,0.97,0.5096,0.2181,-0.23,0.97,0.513,0.2178,-0.22,0.97,0.4937,0.2205,-0.23,0.97,0.4911,0.2172,-0.23,0.97,0.4857,0.2162,-0.22,0.97,0.5215,0.225,-0.1,0.97,0.4792,0.2259,-0.1,0.97,0.5061,0.2471,-0.22,0.97,0.4941,0.2441,-0.22,0.97,0.5632,0.3167,-0.05,0.97,0.4408,0.3212,-0.05,0.97,0.5733,0.4369,-0.05,0.97,0.4271,0.4413,-0.05,0.97,0.5718,0.5516,-0.08,0.97,0.4243,0.5485,-0.08,0.97,0.578,0.5685,-0.09,0.9,0.4211,0.573,-0.09,0.9,0.5746,0.5746,-0.1,0.9,0.426,0.5759,-0.1,0.9,0.5696,0.5662,-0.1,0.9,0.4301,0.5667,-0.1,0.9,0.5364,0.5204,0,0.97,0.4618,0.5212,0,0.97,0.5377,0.6972,-0.05,0.97,0.4632,0.7041,-0.05,0.97,0.5394,0.8812,0.05,0.93,0.4615,0.8779,0.05,0.93,0.5328,0.8947,0.12,0.9,0.4618,0.8898,0.12,0.9,0.5455,0.9041,-0.1,0.9,0.4548,0.899,-0.1,0.9]},{"t":166.7,"lm":[0.5009,0.2293,-0.25,0.97,0.5027,0.2227,-0.23,0.97,0.5099,0.2138,-0.23,0.97,0.5151,0.217,-0.22,0.97,0.4946,0.2152,-0.23,0.97,0.4927,0.2182,-0.23,0.97,0.488,0.2193,-0.22,0.97,0.5228,0.2262,-0.1,0.97,0.4789,0.2264,-0.1,0.97,0.5087,0.2479,-0.22,0.97,0.4922,0.2524,-0.22,0.97,0.5618,0.3189,-0.05,0.97,0.4396,0.3188,-0.05,0.97,0.5704,0.4424,-0.05,0.97,0.4263,0.44,-0.05,0.97,0.5748,0.551,-0.08,0.97,0.4238,0.5489,-0.08,0.97,0.5786,0.572,-0.09,0.9,0.4225,0.5704,-0.09,0.9,0.576,0.5728,-0.1,0.9,0.4262,0.5783,-0.1,0.9,0.5704,0.5644,-0.1,0.9,0.4292,0.5641,-0.1,0.9,0.5399,0.5204,0,0.97,0.4615,0.5207,0,0.97,0.5376,0.6989,-0.05,0.97,0.4625,0.6986,-0.05,0.97,0.5398,0.8804,0.05,0.93,0.4605,0.8799,0.05,0.93,0.5342,0.8926,0.12,0.9,0.464,0.8894,0.12,0.9,0.5465,0.899,-0.1,0.9,0.4547,0.8995,-0.1,0.9]},{"t":200,"lm":[0.5039,0.2284,-0.25,0.97,0.5052,0.2167,-0.23,0.97,0.5096,0.2143,-0.23,0.97,0.5137,0.2175,-0.22,0.97,0.4966,0.2193,-0.23,0.97,0.4883,0.217,-0.23,0.97,0.4887,0.2208,-0.22,0.97,0.5209,0.221,-0.1,0.97,0.4762,0.2247,-0.1,0.97,0.5056,0.2496,-0.22,0.97,0.4946,0.2479,-0.22,0.97,0.5615,0.3173,-0.05,0.97,0.4418,0.3215,-0.05,0.97,0.5748,0.4398,-0.05,0.97,0.4271,0.4396,-0.05,0.97,0.5734,0.549,-0.08,0.97,0.428,0.5509,-0.08,0.97,0.5786,0.5692,-0.09,0.9,0.4188,0.5681,-0.09,0.9,0.5728,0.5744,-0.1,0.9,0.4264,0.5712,-0.1,0.9,0.5721,0.5662,-0.1,0.9,0.4283,0.5671,-0.1,0.9,0.5385,0.5223,0,0.97,0.4627,0.5194,0,0.97,0.5354,0.702,-0.05,0.97,0.4612,0.6989,-0.05,0.97,0.5389,0.8779,0.05,0.93,0.4638,0.8799,0.05,0.93,0.5338,0.8933,0.12,0.9,0.4638,0.8933,0.12,0.9,0.5433,0.8964,-0.1,0.9,0.4546,0.8995,-0.1,0.9]},{"t":233.3,"lm":[0.4977,0.2061,-0.25,0.97,0.5053,0.1901,-0.23,0.97,0.5093,0.1957,-0.23,0.97,0.5126,0.1896,-0.22,0.97,0.4966,0.1907,-0.23,0.97,0.4906,0.1925,-0.23,0.97,0.4881,0.193,-0.22,0.97,0.5213,0.1951,-0.1,0.97,0.4772,0.1994,-0.1,0.97,0.5074,0.2233,-0.22,0.97,0.4916,0.2191,-0.22,0.97,0.5599,0.2941,-0.05,0.97,0.4386,0.2948,-0.05,0.97,0.5691,0.4148,-0.05,0.97,0.4294,0.4169,-0.05,0.97,0.5759,0.5302,-0.08,0.97,0.4246,0.5256,-0.08,0.97,0.5798,0.5457,-0.09,0.9,0.4175,0.5438,-0.09,0.9,0.5734,0.548,-0.1,0.9,0.425,0.5478,-0.1,0.9,0.5698,0.5409,-0.1,0.9,0.4314,0.5413,-0.1,0.9,0.5394,0.4931,0,0.97,0.4608,0.498,0,0.97,0.5366,0.676,-0.05,0.97,0.4619,0.6793,-0.05,0.97,0.5366,0.8526,0.05,0.93,0.4659,0.8561,0.05,0.93,0.534,0.8684,0.12,0.9,0.467,0.8683,0.12,0.9,0.5465,0.8752,-0.1,0.9,0.4534,0.8803,-0.1,0.9]},{"t":266.7,"lm":[0.4998,0.1837,-0.25,0.97,0.5054,0.1731,-0.23,0.97,0.5083,0.1701,-0.23,0.97,0.5129,0.1702,-0.22,0.97,0.4966,0.1725,-0.23,0.97,0.4926,0.1716,-0.23,0.97,0.4856,0.172,-0.22,0.97,0.5235,0.1807,-0.1,0.97,0.4777,0.177,-0.1,0.97,0.5063,0.2021,-0.22,0.97,0.4938,0.1989,-0.22,0.97,0.561,0.2751,-0.05,0.97,0.4401,0.2733,-0.05,0.97,0.5748,0.3926,-0.05,0.97,0.4287,0.3927,-0.05,0.97,0.573,0.5038,-0.08,0.97,0.4237,0.5071,-0.08,0.97,0.5809,0.5282,-0.09,0.9,0.4209,0.5204,-0.09,0.9,0.5734,0.5279,-0.1,0.9,0.4258,0.527,-0.1,0.9,0.5672,0.5223,-0.1,0.9,0.4302,0.5187,-0.1,0.9,0.538,0.4716,0,0.97,0.4639,0.4733,0,0.97,0.5378,0.6554,-0.05,0.97,0.4637,0.6535,-0.05,0.97,0.5397,0.8369,0.05,0.93,0.4619,0.8359,0.05,0.93,0.5381,0.849,0.12,0.9,0.463,0.8467,0.12,0.9,0.5428,0.8543,-0.1,0.9,0.454,0.8536,-0.1,0.9]},{"t":300,"lm":[0.5019,0.1672,-0.25,0.97,0.5035,0.1553,-0.23,0.97,0.5065,0.1552,-0.23,0.97,0.5136,0.1578,-0.22,0.97,0.4954,0.1551,-0.23,0.97,0.4902,0.1532,-0.23,0.97,0.4841,0.1569,-0.22,0.97,0.5232,0.1673,-0.1,0.97,0.4778,0.1617,-0.1,0.97,0.507,0.183,-0.22,0.97,0.4931,0.1793,-0.22,0.97,0.5595,0.2589,-0.05,0.97,0.4417,0.262,-0.05,0.97,0.5708,0.3785,-0.05,0.97,0.4281,0.3783,-0.05,0.97,0.5751,0.4877,-0.08,0.97,0.4271,0.4885,-0.08,0.97,0.5797,0.507,-0.09,0.9,0.4222,0.5041,-0.09,0.9,0.5756,0.5111,-0.1,0.9,0.4223,0.5107,-0.1,0.9,0.5718,0.5058,-0.1,0.9,0.4283,0.5049,-0.1,0.9,0.5393,0.4573,0,0.97,0.4624,0.4558,0,0.97,0.5369,0.6378,-0.05,0.97,0.4661,0.6369,-0.05,0.97,0.5356,0.8179,0.05,0.93,0.4633,0.8177,0.05,0.93,0.5346,0.8331,0.12,0.9,0.4648,0.8299,0.12,0.9,0.5493,0.8364,-0.1,0.9,0.4559,0.8384,-0.1,0.9]},{"t":333.3,"lm":[0.4985,0.1532,-0.25,0.97,0.503,0.1445,-0.23,0.97,0.5087,0.1424,-0.23,0.97,0.5142,0.1422,-0.22,0.97,0.4919,0.1417,-0.23,0.97,0.4914,0.14,-0.23,0.97,0.4881,0.1454,-0.22,0.97,0.5235,0.1463,-0.1,0.97,0.4759,0.1477,-0.1,0.97,0.5088,0.1709,-0.22,0.97,0.4964,0.1731,-0.22,0.97,0.561,0.2433,-0.05,0.97,0.4411,0.2455,-0.05,0.97,0.5737,0.3672,-0.05,0.97,0.4292,0.3671,-0.05,0.97,0.5734,0.4772,-0.08,0.97,0.4273,0.476,-0.08,0.97,0.577,0.4958,-0.09,0.9,0.4189,0.4944,-0.09,0.9,0.5765,0.4992,-0.1,0.9,0.4279,0.4985,-0.1,0.9,0.5691,0.4876,-0.1,0.9,0.4307,0.4926,-0.1,0.9,0.5352,0.4441,0,0.97,0.4617,0.4424,0,0.97,0.5357,0.623,-0.05,0.97,0.4571,0.6223,-0.05,0.97,0.5364,0.8051,0.05,0.93,0.4614,0.8016,0.05,0.93,0.5365,0.8186,0.12,0.9,0.4617,0.8187,0.12,0.9,0.5465,0.8251,-0.1,0.9,0.4532,0.829,-0.1,0.9]},{"t":366.7,"lm":[0.5004,0.1445,-0.25,0.97,0.5048,0.1317,-0.23,0.97,0.5089,0.132,-0.23,0.97,0.5142,0.1343,-0.22,0.97,0.4936,0.1336,-0.23,0.97,0.4896,0.1303,-0.23,0.97,0.4842,0.1335,-0.22,0.97,0.5228,0.1389,-0.1,0.97,0.4769,0.1402,-0.1,0.97,0.5084,0.1628,-0.22,0.97,0.4941,0.1666,-0.22,0.97,0.5608,0.2349,-0.05,0.97,0.4415,0.2343,-0.05,0.97,0.5692,0.3542,-0.05,0.97,0.4279,0.3557,-0.05,0.97,0.5751,0.4666,-0.08,0.97,0.4255,0.4643,-0.08,0.97,0.5772,0.4841,-0.09,0.9,0.4197,0.4855,-0.09,0.9,0.5752,0.4895,-0.1,0.9,0.4262,0.4899,-0.1,0.9,0.5694,0.4809,-0.1,0.9,0.4284,0.481,-0.1,0.9,0.538,0.4384,0,0.97,0.4619,0.437,0,0.97,0.5399,0.6176,-0.05,0.97,0.4648,0.6187,-0.05,0.97,0.5386,0.7943,0.05,0.93